<?xml version="1.0" encoding="UTF-8"?>
<drm owner="Multiverse Games"
    xmlns:xsi="http://www.w3.org/2001/XMLSchema-instance"
    xsi:noNamespaceSchemaLocation="data.xsd">
    <server-info>
		Last update from server at:         <?php echo Date("d.m.Y")?>
    </server-info>
    <games>
        <game id-self="g-1" id-dev="dev-neverlight" rating="E10PLUS">
            <title>Space Scrapper</title>
            <creation-date>TBA</creation-date>
            <description>
				In an intergalactic era, you would think the humanity has finally
				found it's inner peace so to speak. However, there are new dangers
				that await the ever-expanding human race. Extraterrestrial immigrants,
				LGBTS rallies (S stands for Space-kin), and inter-space liberals that
				aim to stomp and destroy all Traditional Values and establich oligarchic
				anarchy upon the galaxy.
				Soon, because of these monstrous intentions, 1st Galactic War took place
				and what used to be a prosperous galactic central, is now but a void
				filled with ashes and scraps of the old world.
				You, as one of the few survivors need to rebuild the civilisation to its
				former glory.
				Embark on your ship into the hostile waste-space, collect resources,
				improve your vessel and root out the bandits that lurk on every corner.
				The Galaxy is counting on you!
            </description>
            <reviews/>
            <achievements>
                <achievement id-self="ach-1-1">
                    <title>Start the game</title>
                    <plain-description>That's right, that's the whole achievo.</plain-description>
                    <secret/>
                    <external-data>ev.onStart</external-data>
                    <points>100</points>
                </achievement>
                <achievement id-self="ach-1-2">
                    <title>Collector</title>
                    <plain-description>Collect 1000 scrap. Seriously it's that easy.</plain-description>
                    <external-data>ge(inv[scrap].quant,1000)</external-data>
                    <points>200</points>
                </achievement>
                <achievement id-self="ach-1-3">
                    <title>Colossus</title>
                    <plain-description>Have a ship of a size at least 150 blocks.</plain-description>
                    <external-data>ge(ship.size,150)</external-data>
                    <points>250</points>
                </achievement>
                <achievement id-self="ach-1-4">
                    <title>Conqueror</title>
                    <plain-description>Visit all 8 main sectors.</plain-description>
                    <external-data>each(map.mainSectors,#.visited)</external-data>
                    <points>450</points>
                </achievement>
            </achievements>
            <ingame-store>
                <ingame-item id-self="item-1-1">
                    <title>Room 1x1</title>
                    <plain-description>Simple small room for your ship.</plain-description>
                    <max-per-user>0</max-per-user>
                    <price>20</price>
                </ingame-item>
                <ingame-item id-self="item-1-2">
                    <title>Room 2x2</title>
                    <plain-description>Simple medium room for your ship.</plain-description>
                    <max-per-user>0</max-per-user>
                    <price>75</price>
                </ingame-item>
                <ingame-item id-self="item-1-3">
                    <title>Room 3x3</title>
                    <plain-description>Simple large room for your ship.</plain-description>
                    <max-per-user>0</max-per-user>
                    <price>165</price>
                </ingame-item>
                <ingame-item id-self="item-1-4">
                    <title>Leeroy Jenkins</title>
                    <plain-description>Unique mercenary for your ship. Make sure he doesn't kill himself.</plain-description>
                    <max-per-user>1</max-per-user>
                    <price>250</price>
                </ingame-item>
            </ingame-store>
        </game>
        <game id-self="g-2" id-dev="dev-neverlight" rating="M">
            <title>The Gunmagedon</title>
            <creation-date>2021-02-01</creation-date>
            <description>
				Have you ever wondered how would a revolver look with incendiary ammo?
				Maybe an acid flamethrower, or a grenade minigun?
				Now's your chance! In this new world driven by gun tinkering and
				prime military engineering, you can create all the weirdest and most
				amazing guns you could ever think of.
				Start your journey in this new, comically hostile world, fight monsters
				and collect mods, and then stick them to your Mastergun. Make the things
				go BOOM!, SPLASH!, RATATATA! or BZZZ! all at the same time in this
				rogue-like gun massacre sandbox.
				Caution: The developers are NOT responsible for any injuries caused by
				excessive experimentation with guns. We strongly advise you to use only
				gun modifications approved by the FUDGE (Fictional Union of Dedicated
				Gun Enthusiasts), which you can find in the User Guide
				                <![CDATA[<link href="https://bit.ly/39yFMpR">here</link>]]>.
            </description>
            <reviews>
                <review author="u-8080">
                    <creation-date>2021-02-01T13:51:39</creation-date>
                    <text>10/10, would kill myself with a wasp-shooting assault rifle again</text>
                    <comment-section/>
                </review>
                <review author="u-1337">
                    <creation-date>2021-02-03T19:22:06</creation-date>
                    <text>
						Found minigun mod, found shotgun mod, found nuclear warhead mod.
						Stuck then together, pressed the shot button.
						My GPU got fried and my house caught on fire.
						I'm currently at my friend's house, gonna try that again.
                    </text>
                    <comment-section/>
                </review>
                <review author="u-4">
                    <creation-date>2021-02-04T00:04:43</creation-date>
                    <text>You can pet the dog.</text>
                    <comment-section>
                        <comment author="u-5">
                            <creation-date>2021-02-04T13:12:11</creation-date>
                            <text>this^</text>
                            <reply-section/>
                        </comment>
                    </comment-section>
                </review>
                <review author="u-7">
                    <creation-date>2021-03-12T16:32:38</creation-date>
                    <text>Difficult but fair. An extremely satisfying ending.</text>
                    <comment-section/>
                </review>
            </reviews>
            <achievements>
                <achievement id-self="ach-2-1">
                    <title>Kill Them All!</title>
                    <plain-description>Kill 2000 enemies. I mean that's the point of this game.</plain-description>
                    <external-data>ge(kills,2000)</external-data>
                    <points>300</points>
                </achievement>
                <achievement id-self="ach-2-2">
                    <title>Dr. OctaBOOM</title>
                    <plain-description>Craft a gun with rocket launcher mod and 7 other mods.</plain-description>
                    <secret/>
                    <external-data>and(any(gun.mods,#.name==RocketLauncher),ge(gun.mods.count,8))</external-data>
                    <points>150</points>
                </achievement>
                <achievement id-self="ach-2-3">
                    <title>GrillMaster</title>
                    <plain-description>Kill 15 enemies with fire projectiles in 8 seconds.</plain-description>
                    <secret/>
                    <external-data>ge(delta(kills.fire,8000),15)</external-data>
                    <points>250</points>
                </achievement>
            </achievements>
            <ingame-store>
                <ingame-item id-self="item-2-1">
                    <title>Rocket Launcher Mod</title>
                    <plain-description>Simple rocket launcher mod.</plain-description>
                    <max-per-user>0</max-per-user>
                    <price>80</price>
                </ingame-item>
                <ingame-item id-self="item-2-2">
                    <title>Minigun Mod</title>
                    <plain-description>Simple minigun mod. Really simple.</plain-description>
                    <max-per-user>0</max-per-user>
                    <price>80</price>
                </ingame-item>
                <ingame-item id-self="item-2-3">
                    <title>Minelayer Mod</title>
                    <plain-description>Simple minelayer mod.</plain-description>
                    <max-per-user>0</max-per-user>
                    <price>80</price>
                </ingame-item>
                <ingame-item id-self="item-2-4">
                    <title>Fragmine</title>
                    <plain-description>Simple fragmine mod.</plain-description>
                    <max-per-user>0</max-per-user>
                    <price>120</price>
                </ingame-item>
                <ingame-item id-self="item-2-5">
                    <title>Cryolator</title>
                    <plain-description>Freezing mod for your gun.</plain-description>
                    <max-per-user>1</max-per-user>
                    <price>250</price>
                </ingame-item>
            </ingame-store>
        </game>
        <game id-self="g-4" id-dev="dev-sugar-powered" rating="T">
            <title>Geneloper</title>
            <creation-date>2021-06-03</creation-date>
            <description>
				In the beginning you created the heavens and the earth.